GEO.id,GEO.id2,GEO.display-label,HC01_EST_VC02,HC01_MOE_VC02,HC02_EST_VC02,HC02_MOE_VC02,HC01_EST_VC04,HC01_MOE_VC04,HC02_EST_VC04,HC02_MOE_VC04,HC01_EST_VC05,HC01_MOE_VC05,HC02_EST_VC05,HC02_MOE_VC05,HC01_EST_VC06,HC01_MOE_VC06,HC02_EST_VC06,HC02_MOE_VC06,HC01_EST_VC07,HC01_MOE_VC07,HC02_EST_VC07,HC02_MOE_VC07,HC01_EST_VC08,HC01_MOE_VC08,HC02_EST_VC08,HC02_MOE_VC08,HC01_EST_VC09,HC01_MOE_VC09,HC02_EST_VC09,HC02_MOE_VC09,HC01_EST_VC10,HC01_MOE_VC10,HC02_EST_VC10,HC02_MOE_VC10,HC01_EST_VC12,HC01_MOE_VC12,HC02_EST_VC12,HC02_MOE_VC12,HC01_EST_VC13,HC01_MOE_VC13,HC02_EST_VC13,HC02_MOE_VC13,HC01_EST_VC16,HC01_MOE_VC16,HC02_EST_VC16,HC02_MOE_VC16,HC01_EST_VC17,HC01_MOE_VC17,HC02_EST_VC17,HC02_MOE_VC17,HC01_EST_VC18,HC01_MOE_VC18,HC02_EST_VC18,HC02_MOE_VC18,HC01_EST_VC19,HC01_MOE_VC19,HC02_EST_VC19,HC02_MOE_VC19,HC01_EST_VC22,HC01_MOE_VC22,HC02_EST_VC22,HC02_MOE_VC22,HC01_EST_VC23,HC01_MOE_VC23,HC02_EST_VC23,HC02_MOE_VC23,HC01_EST_VC24,HC01_MOE_VC24,HC02_EST_VC24,HC02_MOE_VC24,HC01_EST_VC25,HC01_MOE_VC25,HC02_EST_VC25,HC02_MOE_VC25,HC01_EST_VC26,HC01_MOE_VC26,HC02_EST_VC26,HC02_MOE_VC26,HC01_EST_VC27,HC01_MOE_VC27,HC02_EST_VC27,HC02_MOE_VC27,HC01_EST_VC30,HC01_MOE_VC30,HC02_EST_VC30,HC02_MOE_VC30,HC01_EST_VC31,HC01_MOE_VC31,HC02_EST_VC31,HC02_MOE_VC31,HC01_EST_VC32,HC01_MOE_VC32,HC02_EST_VC32,HC02_MOE_VC32,HC01_EST_VC33,HC01_MOE_VC33,HC02_EST_VC33,HC02_MOE_VC33,HC01_EST_VC34,HC01_MOE_VC34,HC02_EST_VC34,HC02_MOE_VC34,HC01_EST_VC35,HC01_MOE_VC35,HC02_EST_VC35,HC02_MOE_VC35,HC01_EST_VC36,HC01_MOE_VC36,HC02_EST_VC36,HC02_MOE_VC36,HC01_EST_VC39,HC01_MOE_VC39,HC02_EST_VC39,HC02_MOE_VC39,HC01_EST_VC40,HC01_MOE_VC40,HC02_EST_VC40,HC02_MOE_VC40,HC01_EST_VC41,HC01_MOE_VC41,HC02_EST_VC41,HC02_MOE_VC41
Id,Id2,Geography,Total; Estimate; Households,Total; Margin of Error; Households,Median income (dollars); Estimate; Households,Median income (dollars); Margin of Error; Households,Total; Estimate; Households - One race-- - White,Total; Margin of Error; Households - One race-- - White,Median income (dollars); Estimate; Households - One race-- - White,Median income (dollars); Margin of Error; Households - One race-- - White,Total; Estimate; Households - One race-- - Black or African American,Total; Margin of Error; Households - One race-- - Black or African American,Median income (dollars); Estimate; Households - One race-- - Black or African American,Median income (dollars); Margin of Error; Households - One race-- - Black or African American,Total; Estimate; Households - One race-- - American Indian and Alaska Native,Total; Margin of Error; Households - One race-- - American Indian and Alaska Native,Median income (dollars); Estimate; Households - One race-- - American Indian and Alaska Native,Median income (dollars); Margin of Error; Households - One race-- - American Indian and Alaska Native,Total; Estimate; Households - One race-- - Asian,Total; Margin of Error; Households - One race-- - Asian,Median income (dollars); Estimate; Households - One race-- - Asian,Median income (dollars); Margin of Error; Households - One race-- - Asian,Total; Estimate; Households - One race-- - Native Hawaiian and Other Pacific Islander,Total; Margin of Error; Households - One race-- - Native Hawaiian and Other Pacific Islander,Median income (dollars); Estimate; Households - One race-- - Native Hawaiian and Other Pacific Islander,Median income (dollars); Margin of Error; Households - One race-- - Native Hawaiian and Other Pacific Islander,Total; Estimate; Households - One race-- - Some other race,Total; Margin of Error; Households - One race-- - Some other race,Median income (dollars); Estimate; Households - One race-- - Some other race,Median income (dollars); Margin of Error; Households - One race-- - Some other race,Total; Estimate; Households - Two or more races,Total; Margin of Error; Households - Two or more races,Median income (dollars); Estimate; Households - Two or more races,Median income (dollars); Margin of Error; Households - Two or more races,Total; Estimate; Hispanic or Latino origin (of any race),Total; Margin of Error; Hispanic or Latino origin (of any race),Median income (dollars); Estimate; Hispanic or Latino origin (of any race),Median income (dollars); Margin of Error; Hispanic or Latino origin (of any race),"Total; Estimate; White alone, not Hispanic or Latino","Total; Margin of Error; White alone, not Hispanic or Latino","Median income (dollars); Estimate; White alone, not Hispanic or Latino","Median income (dollars); Margin of Error; White alone, not Hispanic or Latino",Total; Estimate; HOUSEHOLD INCOME BY AGE OF HOUSEHOLDER - 15 to 24 years,Total; Margin of Error; HOUSEHOLD INCOME BY AGE OF HOUSEHOLDER - 15 to 24 years,Median income (dollars); Estimate; HOUSEHOLD INCOME BY AGE OF HOUSEHOLDER - 15 to 24 years,Median income (dollars); Margin of Error; HOUSEHOLD INCOME BY AGE OF HOUSEHOLDER - 15 to 24 years,Total; Estimate; HOUSEHOLD INCOME BY AGE OF HOUSEHOLDER - 25 to 44 years,Total; Margin of Error; HOUSEHOLD INCOME BY AGE OF HOUSEHOLDER - 25 to 44 years,Median income (dollars); Estimate; HOUSEHOLD INCOME BY AGE OF HOUSEHOLDER - 25 to 44 years,Median income (dollars); Margin of Error; HOUSEHOLD INCOME BY AGE OF HOUSEHOLDER - 25 to 44 years,Total; Estimate; HOUSEHOLD INCOME BY AGE OF HOUSEHOLDER - 45 to 64 years,Total; Margin of Error; HOUSEHOLD INCOME BY AGE OF HOUSEHOLDER - 45 to 64 years,Median income (dollars); Estimate; HOUSEHOLD INCOME BY AGE OF HOUSEHOLDER - 45 to 64 years,Median income (dollars); Margin of Error; HOUSEHOLD INCOME BY AGE OF HOUSEHOLDER - 45 to 64 years,Total; Estimate; HOUSEHOLD INCOME BY AGE OF HOUSEHOLDER - 65 years and over,Total; Margin of Error; HOUSEHOLD INCOME BY AGE OF HOUSEHOLDER - 65 years and over,Median income (dollars); Estimate; HOUSEHOLD INCOME BY AGE OF HOUSEHOLDER - 65 years and over,Median income (dollars); Margin of Error; HOUSEHOLD INCOME BY AGE OF HOUSEHOLDER - 65 years and over,Total; Estimate; FAMILIES - Families,Total; Margin of Error; FAMILIES - Families,Median income (dollars); Estimate; FAMILIES - Families,Median income (dollars); Margin of Error; FAMILIES - Families,Total; Estimate; FAMILIES - Families - With own children under 18 years,Total; Margin of Error; FAMILIES - Families - With own children under 18 years,Median income (dollars); Estimate; FAMILIES - Families - With own children under 18 years,Median income (dollars); Margin of Error; FAMILIES - Families - With own children under 18 years,Total; Estimate; FAMILIES - Families - With no own children under 18 years,Total; Margin of Error; FAMILIES - Families - With no own children under 18 years,Median income (dollars); Estimate; FAMILIES - Families - With no own children under 18 years,Median income (dollars); Margin of Error; FAMILIES - Families - With no own children under 18 years,Total; Estimate; FAMILIES - Families - Married-couple families,Total; Margin of Error; FAMILIES - Families - Married-couple families,Median income (dollars); Estimate; FAMILIES - Families - Married-couple families,Median income (dollars); Margin of Error; FAMILIES - Families - Married-couple families,"Total; Estimate; FAMILIES - Families - Female householder, no husband present","Total; Margin of Error; FAMILIES - Families - Female householder, no husband present","Median income (dollars); Estimate; FAMILIES - Families - Female householder, no husband present","Median income (dollars); Margin of Error; FAMILIES - Families - Female householder, no husband present","Total; Estimate; FAMILIES - Families - Male householder, no wife present","Total; Margin of Error; FAMILIES - Families - Male householder, no wife present","Median income (dollars); Estimate; FAMILIES - Families - Male householder, no wife present","Median income (dollars); Margin of Error; FAMILIES - Families - Male householder, no wife present",Total; Estimate; NONFAMILY HOUSEHOLDS - Nonfamily households,Total; Margin of Error; NONFAMILY HOUSEHOLDS - Nonfamily households,Median income (dollars); Estimate; NONFAMILY HOUSEHOLDS - Nonfamily households,Median income (dollars); Margin of Error; NONFAMILY HOUSEHOLDS - Nonfamily households,Total; Estimate; NONFAMILY HOUSEHOLDS - Nonfamily households - Female householder,Total; Margin of Error; NONFAMILY HOUSEHOLDS - Nonfamily households - Female householder,Median income (dollars); Estimate; NONFAMILY HOUSEHOLDS - Nonfamily households - Female householder,Median income (dollars); Margin of Error; NONFAMILY HOUSEHOLDS - Nonfamily households - Female householder,Total; Estimate; NONFAMILY HOUSEHOLDS - Nonfamily households - Female householder - Living alone,Total; Margin of Error; NONFAMILY HOUSEHOLDS - Nonfamily households - Female householder - Living alone,Median income (dollars); Estimate; NONFAMILY HOUSEHOLDS - Nonfamily households - Female householder - Living alone,Median income (dollars); Margin of Error; NONFAMILY HOUSEHOLDS - Nonfamily households - Female householder - Living alone,Total; Estimate; NONFAMILY HOUSEHOLDS - Nonfamily households - Female householder - Not living alone,Total; Margin of Error; NONFAMILY HOUSEHOLDS - Nonfamily households - Female householder - Not living alone,Median income (dollars); Estimate; NONFAMILY HOUSEHOLDS - Nonfamily households - Female householder - Not living alone,Median income (dollars); Margin of Error; NONFAMILY HOUSEHOLDS - Nonfamily households - Female householder - Not living alone,Total; Estimate; NONFAMILY HOUSEHOLDS - Nonfamily households - Male householder,Total; Margin of Error; NONFAMILY HOUSEHOLDS - Nonfamily households - Male householder,Median income (dollars); Estimate; NONFAMILY HOUSEHOLDS - Nonfamily households - Male householder,Median income (dollars); Margin of Error; NONFAMILY HOUSEHOLDS - Nonfamily households - Male householder,Total; Estimate; NONFAMILY HOUSEHOLDS - Nonfamily households - Male householder - Living alone,Total; Margin of Error; NONFAMILY HOUSEHOLDS - Nonfamily households - Male householder - Living alone,Median income (dollars); Estimate; NONFAMILY HOUSEHOLDS - Nonfamily households - Male householder - Living alone,Median income (dollars); Margin of Error; NONFAMILY HOUSEHOLDS - Nonfamily households - Male householder - Living alone,Total; Estimate; NONFAMILY HOUSEHOLDS - Nonfamily households - Male householder - Not living alone,Total; Margin of Error; NONFAMILY HOUSEHOLDS - Nonfamily households - Male householder - Not living alone,Median income (dollars); Estimate; NONFAMILY HOUSEHOLDS - Nonfamily households - Male householder - Not living alone,Median income (dollars); Margin of Error; NONFAMILY HOUSEHOLDS - Nonfamily households - Male householder - Not living alone,Total; Estimate; PERCENT IMPUTED - Household income in the past 12 months,Total; Margin of Error; PERCENT IMPUTED - Household income in the past 12 months,Median income (dollars); Estimate; PERCENT IMPUTED - Household income in the past 12 months,Median income (dollars); Margin of Error; PERCENT IMPUTED - Household income in the past 12 months,Total; Estimate; PERCENT IMPUTED - Family income in the past 12 months,Total; Margin of Error; PERCENT IMPUTED - Family income in the past 12 months,Median income (dollars); Estimate; PERCENT IMPUTED - Family income in the past 12 months,Median income (dollars); Margin of Error; PERCENT IMPUTED - Family income in the past 12 months,Total; Estimate; PERCENT IMPUTED - Nonfamily income in the past 12 months,Total; Margin of Error; PERCENT IMPUTED - Nonfamily income in the past 12 months,Median income (dollars); Estimate; PERCENT IMPUTED - Nonfamily income in the past 12 months,Median income (dollars); Margin of Error; PERCENT IMPUTED - Nonfamily income in the past 12 months
0500000US34001,34001,"Atlantic County, New Jersey",101166,882,54392,1335,72.0,0.6,60759,1152,15.8,0.5,33596,2085,0.3,0.1,19087,14943,5.8,0.2,56597,5737,0.1,0.1,80591,48873,4.2,0.5,42514,2086,2.0,0.3,49950,10793,13.2,0.5,41373,2196,64.8,0.6,63277,1620,2.1,0.3,32500,5419,28.8,0.7,54099,2027,44.2,0.7,65633,1549,24.8,0.5,40231,1971,67414,1147,66360,1490,43.6,1.2,56638,2221,56.4,1.2,73293,1971,67.3,1.2,83602,2000,24.4,1.0,36191,1666,8.2,0.8,49648,3543,33752,1049,31444,1463,54.8,1.4,28943,1843,46.9,1.4,25359,1302,8.0,1.1,65905,6546,45.2,1.4,35365,3365,36.8,1.5,29948,2459,8.3,0.9,61305,4940,34.8,(X),(X),(X),35.4,(X),(X),(X),31.0,(X),(X),(X)
0500000US34003,34003,"Bergen County, New Jersey",335671,1178,83686,1281,74.6,0.3,86109,1161,5.7,0.2,64001,2121,0.2,0.1,41270,23181,13.7,0.2,92885,1923,0.0,0.1,71220,7900,4.5,0.2,57457,5993,1.4,0.1,71600,6504,14.4,0.3,62480,2486,65.5,0.3,89493,1284,1.4,0.2,43788,3978,30.6,0.3,91917,2189,43.2,0.3,101354,1542,24.8,0.3,50542,1593,240414,1794,102429,1439,44.2,0.5,110793,2391,55.8,0.5,96362,1425,78.2,0.6,118052,1918,15.7,0.5,53461,1816,6.1,0.3,68587,5382,95257,1878,44064,1383,58.3,1.0,37104,1683,52.3,1.0,33261,1216,6.0,0.5,87352,4766,41.7,1.0,54239,1804,34.0,0.9,49713,2519,7.7,0.7,85852,2877,31.3,(X),(X),(X),31.9,(X),(X),(X),28.2,(X),(X),(X)
0500000US34005,34005,"Burlington County, New Jersey",164736,956,79612,1097,77.4,0.4,81431,918,15.0,0.3,68278,2079,0.1,0.1,64777,10728,3.6,0.2,109869,12092,0.0,0.1,151417,9990,1.8,0.2,61926,6918,2.0,0.2,74428,9833,4.9,0.2,69835,7321,74.6,0.4,81856,975,1.5,0.2,39661,6752,29.2,0.5,85318,2113,44.5,0.4,96165,1546,24.7,0.4,49646,1488,115647,1121,95974,1213,43.2,0.6,100295,2312,56.8,0.6,93489,1227,77.1,0.8,109276,1397,16.6,0.7,55445,2537,6.3,0.5,64310,4909,49089,1171,44899,1398,57.1,1.2,38733,1887,50.1,1.3,34551,1316,7.0,0.7,81720,5493,42.9,1.2,52014,1668,34.2,1.2,46572,1754,8.7,1.0,78677,6924,27.2,(X),(X),(X),28.0,(X),(X),(X),23.9,(X),(X),(X)
0500000US34007,34007,"Camden County, New Jersey",187121,994,61842,1064,67.5,0.5,70691,966,19.4,0.4,42645,2312,0.3,0.1,22274,9877,4.6,0.2,75342,5568,0.0,0.1,14556,101192,6.5,0.3,36126,4441,1.7,0.2,54066,6969,11.4,0.3,39174,2713,64.0,0.4,72151,1015,2.1,0.2,24406,4247,32.8,0.4,65636,2067,42.2,0.4,76775,1365,23.0,0.3,38476,1424,125928,1509,76671,1215,45.1,0.6,73551,2712,54.9,0.6,79018,1853,68.2,0.9,94795,1786,24.0,0.8,36058,1553,7.8,0.6,52172,2326,61193,1271,34314,1009,57.1,1.1,28915,1260,50.2,1.1,25802,1041,6.9,0.6,67257,5929,42.9,1.1,40939,2001,33.7,1.1,34974,1546,9.2,0.8,79040,5639,34.7,(X),(X),(X),35.8,(X),(X),(X),30.7,(X),(X),(X)
0500000US34009,34009,"Cape May County, New Jersey",41069,915,57394,1758,93.7,0.6,58536,1839,3.6,0.6,39774,4406,0.2,0.2,19191,49988,0.7,0.1,59875,79835,0.0,0.1,-,**,0.8,0.3,33906,26434,0.9,0.3,32917,24956,3.9,0.5,45821,17156,91.1,0.7,59092,1914,2.5,0.6,27449,6308,21.1,0.9,63486,4685,42.4,0.9,76395,3481,33.9,0.8,41680,1564,26685,620,75370,2906,33.8,1.4,74831,6698,66.2,1.4,75533,3155,79.3,1.9,83348,2337,14.7,1.6,40162,6669,6.0,0.9,51748,2584,14384,711,32977,2621,57.9,2.0,30939,2300,51.2,2.3,27878,1719,6.7,1.2,58344,12185,42.1,2.0,36986,4726,35.8,2.1,31595,3801,6.3,1.5,69500,17652,28.8,(X),(X),(X),30.3,(X),(X),(X),25.3,(X),(X),(X)
0500000US34011,34011,"Cumberland County, New Jersey",50399,578,50603,1419,70.1,0.8,55833,1891,16.8,0.7,41804,2876,0.8,0.2,36346,27865,1.2,0.2,72938,52351,0.0,0.1,-,**,8.9,0.9,38735,8775,2.3,0.5,46204,12961,20.4,1.0,39586,4850,60.6,0.9,58183,1956,2.8,0.5,27080,3232,31.7,0.9,52993,2840,40.9,0.9,62452,3644,24.6,0.7,34413,2223,35157,678,59327,2072,44.1,1.6,53673,2970,55.9,1.6,62400,2857,63.1,1.8,75251,2136,27.6,1.6,31532,2549,9.3,1.2,47068,3614,15242,659,28208,2850,55.8,2.4,24857,1782,48.4,2.2,22122,1650,7.4,1.3,68025,9461,44.2,2.4,34364,5089,33.5,2.6,28007,3441,10.7,1.8,56303,7295,35.8,(X),(X),(X),37.1,(X),(X),(X),28.8,(X),(X),(X)
0500000US34013,34013,"Essex County, New Jersey",277745,1334,54499,756,44.4,0.4,80010,1620,41.4,0.4,37882,949,0.3,0.1,32892,7872,4.1,0.1,103173,5891,0.0,0.1,31797,48484,7.6,0.3,37868,1594,2.2,0.2,41601,5502,17.5,0.3,43202,1830,36.0,0.3,90226,2129,2.3,0.2,22632,3184,35.9,0.3,53844,1178,41.0,0.3,67317,1550,20.9,0.3,36625,1352,180154,1591,69018,1620,50.2,0.5,62943,1757,49.8,0.5,74651,2054,59.7,0.6,103507,1986,30.9,0.6,33990,1367,9.4,0.4,43370,2621,97591,1400,31745,690,55.4,1.0,27696,997,49.1,1.0,24906,981,6.3,0.5,67680,4279,44.6,1.0,36732,1437,36.5,0.9,31849,884,8.0,0.6,64113,4750,38.0,(X),(X),(X),39.2,(X),(X),(X),33.0,(X),(X),(X)
0500000US34015,34015,"Gloucester County, New Jersey",104435,628,76213,1293,85.0,0.4,78913,1774,9.9,0.4,57595,6091,0.2,0.1,45817,33203,2.2,0.1,106563,10207,0.0,0.1,-,**,1.5,0.2,52396,8523,1.3,0.3,55278,12970,3.8,0.3,54641,3830,83.2,0.4,79307,1800,2.3,0.3,24479,7350,30.8,0.5,86093,2402,44.5,0.6,90765,2046,22.4,0.4,44270,1236,75799,923,90352,1599,44.6,0.7,97880,3291,55.4,0.7,86530,2047,76.5,1.1,104909,1896,17.2,0.9,46634,3625,6.2,0.6,65562,6259,28636,875,39676,1936,55.0,1.4,33727,2088,47.5,1.6,30120,1933,7.6,0.9,71359,7069,45.0,1.4,47285,2289,35.0,1.7,42336,4259,10.0,1.3,66471,7146,27.9,(X),(X),(X),28.9,(X),(X),(X),24.1,(X),(X),(X)
0500000US34017,34017,"Hudson County, New Jersey",246135,1315,58973,1294,59.8,0.5,60698,1160,12.4,0.3,44252,2422,0.3,0.1,39519,21854,13.5,0.3,92096,3389,0.0,0.1,87548,93692,11.6,0.4,42731,2295,2.4,0.2,60057,9806,37.7,0.4,42945,1284,36.1,0.4,76523,1422,3.1,0.2,38321,3375,45.3,0.5,75052,1469,34.9,0.4,59549,1925,16.7,0.3,30040,1358,151838,1323,62103,1284,46.2,0.8,52988,1524,53.8,0.8,69819,1679,61.8,0.9,82861,1763,27.8,0.8,31767,1255,10.4,0.6,50022,2656,94297,1328,48792,1451,48.5,0.9,35531,2148,39.0,1.0,27110,1164,9.5,0.6,92341,8980,51.5,0.9,59256,2613,36.6,1.0,47249,2485,14.9,0.8,102789,4025,39.1,(X),(X),(X),42.0,(X),(X),(X),31.8,(X),(X),(X)
0500000US34019,34019,"Hunterdon County, New Jersey",46951,437,106519,3055,94.6,0.5,107491,2701,0.8,0.2,61607,5488,0.0,0.1,149167,127733,3.1,0.3,122457,19560,0.1,0.1,-,**,0.8,0.3,47156,46844,0.5,0.2,101328,58648,4.0,0.4,75733,14423,91.5,0.4,108134,2491,0.6,0.2,33832,4858,24.0,0.7,111488,3312,51.9,0.7,127266,5460,23.5,0.6,60904,3093,34329,557,126042,2690,43.8,1.1,132470,4297,56.2,1.1,119893,4096,85.4,1.0,138150,3305,10.7,1.0,59029,3425,3.9,0.6,85455,16591,12622,500,51646,2620,55.5,2.7,41875,5153,48.3,2.8,36951,2654,7.3,1.5,101103,14584,44.5,2.7,67730,7025,36.2,2.9,59392,10492,8.3,1.7,101686,16311,23.6,(X),(X),(X),24.1,(X),(X),(X),20.0,(X),(X),(X)
0500000US34021,34021,"Mercer County, New Jersey",131475,877,74118,1465,66.6,0.5,84614,3077,19.9,0.3,41961,2819,0.1,0.1,25125,32180,8.0,0.3,132254,11763,0.0,0.1,-,**,4.0,0.4,52334,5989,1.3,0.2,63750,11397,11.5,0.4,50620,3555,59.7,0.5,89509,2165,2.3,0.3,33475,5290,32.2,0.5,75933,2158,43.0,0.5,92197,2408,22.6,0.3,50027,2161,88753,1229,94636,1851,45.8,1.0,95963,3742,54.2,1.0,93960,2083,73.7,1.1,115214,2275,19.4,0.9,45345,3717,6.9,0.6,51978,7637,42722,1082,40063,1486,57.5,1.3,37279,2114,48.5,1.4,32362,1799,8.9,0.9,68349,6537,42.5,1.3,46481,4990,34.0,1.5,37979,3267,8.5,0.8,83904,7113,31.1,(X),(X),(X),31.0,(X),(X),(X),29.5,(X),(X),(X)
0500000US34023,34023,"Middlesex County, New Jersey",282182,1049,80118,876,66.5,0.3,73888,1407,9.6,0.2,67695,3469,0.2,0.1,78333,18934,19.3,0.2,110284,2498,0.0,0.1,88849,16389,2.9,0.2,59747,4182,1.5,0.1,75226,8711,15.3,0.3,55222,1643,54.9,0.3,79413,1459,1.8,0.1,32046,3006,35.3,0.3,88057,2052,41.6,0.3,93007,1664,21.3,0.3,47158,1233,204678,1604,93870,1256,47.6,0.6,98993,2728,52.4,0.6,90064,1543,76.4,0.7,107595,1424,17.0,0.6,51711,2173,6.7,0.4,61904,3112,77504,1548,43542,1417,56.1,1.1,35305,1365,48.8,1.2,31975,1213,7.3,0.7,73868,6537,43.9,1.1,55518,2352,34.3,1.1,50110,2099,9.6,0.7,91681,7659,31.6,(X),(X),(X),31.9,(X),(X),(X),29.3,(X),(X),(X)
0500000US34025,34025,"Monmouth County, New Jersey",233730,1112,85605,997,85.6,0.3,89731,1369,6.9,0.3,44940,2584,0.1,0.1,27100,7927,4.2,0.1,123686,8079,0.0,0.1,46750,149129,1.7,0.2,45155,5168,1.3,0.1,58595,7403,7.4,0.3,53510,3295,80.6,0.3,91819,1371,1.4,0.1,33391,7365,27.4,0.4,91011,2188,46.4,0.4,105437,1608,24.8,0.3,51243,1390,162376,1244,107343,1283,44.7,0.6,112276,2691,55.3,0.6,103722,1755,79.2,0.6,123329,1785,15.3,0.5,48949,2775,5.6,0.4,60710,2760,71354,1353,43455,1507,57.4,1.0,36471,1890,50.2,1.1,31819,1388,7.2,0.7,85062,5900,42.6,1.0,54321,2021,34.3,1.0,47322,2423,8.2,0.7,89035,6928,31.9,(X),(X),(X),32.5,(X),(X),(X),29.3,(X),(X),(X)
0500000US34027,34027,"Morris County, New Jersey",179776,936,99142,1213,85.4,0.3,99854,1157,3.2,0.2,71627,9660,0.1,0.1,83125,36369,8.1,0.2,116875,7308,0.0,0.1,-,**,2.3,0.2,62492,5842,0.9,0.2,102614,7587,9.3,0.3,68704,3309,78.8,0.4,102014,1183,0.9,0.2,52385,8419,29.5,0.4,105212,1974,45.8,0.4,117675,2585,23.8,0.3,60191,2302,128869,1269,118325,1570,46.5,0.6,126776,3034,53.5,0.6,112389,2093,83.4,0.7,131431,1986,11.9,0.5,64764,4403,4.8,0.5,84448,6964,50907,1082,54056,1672,57.1,1.2,46519,2156,50.4,1.3,42019,2357,6.7,0.8,96862,4482,42.9,1.2,64781,3431,34.1,1.2,55222,3342,8.8,1.0,103590,9216,28.1,(X),(X),(X),27.9,(X),(X),(X),26.7,(X),(X),(X)
0500000US34029,34029,"Ocean County, New Jersey",221720,1229,61839,718,93.8,0.2,62130,780,2.8,0.2,50740,3005,0.1,0.1,25950,11835,1.4,0.1,78597,14440,0.0,0.1,75556,214364,1.1,0.1,48441,7190,0.8,0.1,60833,16588,5.7,0.2,55715,5808,89.4,0.3,62176,770,1.2,0.2,32691,6428,24.7,0.4,73150,2169,37.9,0.4,83002,1569,36.2,0.3,39986,913,148949,1396,77118,1362,38.6,0.6,78771,3157,61.4,0.6,76365,1640,79.4,0.7,85709,1502,14.7,0.6,46375,1905,5.9,0.4,60786,4312,72771,1364,33122,934,62.0,1.0,28284,1050,56.4,1.1,26432,903,5.6,0.5,64901,4913,38.0,1.0,44669,2087,31.0,1.0,38826,2558,7.0,0.7,76411,8593,30.2,(X),(X),(X),30.9,(X),(X),(X),27.1,(X),(X),(X)
0500000US34031,34031,"Passaic County, New Jersey",162097,916,59513,1285,69.6,0.6,70409,1817,12.9,0.3,33710,1773,0.3,0.1,52333,18105,4.3,0.2,94811,6619,0.0,0.1,-,**,10.0,0.5,34382,2897,2.8,0.3,41015,5197,31.7,0.5,40233,1251,51.2,0.5,81006,1454,1.7,0.2,32525,5172,33.6,0.5,55498,2373,43.1,0.5,76573,2037,21.6,0.4,41180,1736,118219,1298,69341,1709,47.5,1.0,58506,3285,52.5,1.0,78651,1905,66.3,1.0,91169,2682,25.4,0.8,32938,1588,8.3,0.5,48759,5240,43878,1171,33111,1744,55.2,1.5,27791,2259,49.6,1.4,24805,1465,5.6,0.7,71468,8185,44.8,1.5,40822,2739,37.0,1.5,34140,2220,7.8,1.0,88573,9823,35.8,(X),(X),(X),36.9,(X),(X),(X),29.9,(X),(X),(X)
0500000US34033,34033,"Salem County, New Jersey",24665,333,60768,2502,83.0,0.9,65803,1892,13.7,0.8,31015,3392,0.3,0.2,20000,12430,0.9,0.2,92593,31171,0.0,0.1,-,**,1.1,0.3,34500,7324,1.0,0.3,41964,38465,4.5,0.5,41591,7173,80.0,0.8,67171,1965,1.9,0.5,21821,13588,28.4,0.8,69149,4797,42.6,1.2,74386,3994,27.1,0.8,41121,3037,16930,391,73770,2701,41.3,1.8,72572,4269,58.7,1.8,74930,3859,71.0,1.9,89529,4412,21.7,1.8,30142,4432,7.3,1.2,50324,9663,7735,379,32163,3296,52.5,2.7,23718,2306,46.0,3.0,21727,1968,6.6,1.6,65581,15451,47.5,2.7,44636,4359,38.1,3.0,40223,3182,9.3,1.9,67917,13767,32.2,(X),(X),(X),32.7,(X),(X),(X),29.2,(X),(X),(X)
0500000US34035,34035,"Somerset County, New Jersey",115941,655,100903,1388,74.1,0.6,100375,1618,8.3,0.3,76863,5673,0.1,0.1,42115,6746,13.3,0.3,135520,6869,0.0,0.1,-,**,3.0,0.4,67837,13014,1.1,0.2,103359,11578,10.3,0.4,71971,8217,67.1,0.6,103741,2089,0.9,0.2,49013,10347,30.8,0.6,107500,3252,46.8,0.6,119065,3292,21.4,0.5,57725,2836,84439,997,119475,2363,48.7,0.8,126714,4606,51.3,0.8,113652,3426,82.6,1.0,134717,3423,13.3,0.8,63956,3277,4.1,0.5,66921,3870,31502,1073,54009,2316,59.0,1.6,46611,2330,52.4,1.6,42980,2273,6.6,1.0,104656,8827,41.0,1.6,65067,4026,33.1,1.8,57819,4996,7.9,1.2,106420,14393,36.5,(X),(X),(X),36.6,(X),(X),(X),34.8,(X),(X),(X)
0500000US34037,34037,"Sussex County, New Jersey",54248,515,87397,2020,95.6,0.4,87258,2079,1.5,0.2,82835,33846,0.1,0.1,110556,10591,1.4,0.2,121042,35123,0.0,0.1,-,**,0.7,0.3,56776,38946,0.8,0.3,97656,60358,5.1,0.4,84479,16404,91.5,0.5,87203,1982,1.1,0.3,31958,6494,27.6,0.6,96707,4247,49.7,0.7,98157,2607,21.5,0.5,54970,2763,40051,597,100713,2125,42.4,1.1,104986,3784,57.6,1.1,96438,2899,81.4,1.1,110241,2386,12.9,0.9,53378,3303,5.7,0.7,74775,7124,14197,631,44737,3111,50.8,2.2,36648,2891,43.5,1.9,31854,2570,7.3,1.5,88550,16934,49.2,2.2,52942,3547,38.7,2.3,47051,5223,10.4,1.6,82292,26002,28.3,(X),(X),(X),29.2,(X),(X),(X),24.3,(X),(X),(X)
0500000US34039,34039,"Union County, New Jersey",185688,977,69396,1269,61.2,0.5,81946,1835,22.1,0.3,53018,1843,0.2,0.1,35370,21625,4.4,0.2,111549,12349,0.0,0.1,105179,101872,10.7,0.5,45968,2062,1.3,0.2,65928,5266,23.7,0.4,50299,2098,49.0,0.4,91154,2245,1.5,0.2,39698,6454,33.7,0.4,70177,2130,43.1,0.4,85392,2292,21.8,0.4,44770,1580,132464,1348,83390,1636,48.9,0.7,76434,2530,51.1,0.7,88237,1730,69.4,0.8,107378,2041,22.5,0.7,42080,1819,8.1,0.6,50894,2679,53224,1290,37898,1283,56.6,1.2,32784,1819,50.9,1.1,30306,1470,5.7,0.7,74338,6735,43.4,1.2,44840,2190,34.8,1.3,39263,1772,8.6,0.8,75645,6443,35.2,(X),(X),(X),35.1,(X),(X),(X),32.7,(X),(X),(X)
0500000US34041,34041,"Warren County, New Jersey",41548,459,70934,1742,92.0,0.6,71904,1882,3.0,0.2,78882,33245,0.2,0.2,30150,17594,1.9,0.2,71083,24073,0.0,0.1,-,**,1.7,0.5,54886,5272,1.1,0.3,60134,12035,5.1,0.5,53433,4185,88.7,0.6,72255,1930,1.7,0.4,26786,11113,28.9,0.7,80488,4807,46.4,0.8,84369,2749,23.0,0.7,43182,2420,28982,572,86205,2158,43.6,1.3,89746,2682,56.4,1.3,82677,3386,79.3,1.6,98024,2294,15.0,1.4,44069,6245,5.7,0.9,55469,4291,12566,634,41742,3698,55.7,2.7,34851,2651,48.1,2.7,31217,1950,7.5,1.4,74100,13894,44.3,2.7,47741,4232,34.5,2.3,43108,3687,9.9,1.9,65528,10390,26.3,(X),(X),(X),26.1,(X),(X),(X),25.2,(X),(X),(X)
